{
  "$schema": "https://json-schema.org/draft/2020-12/schema",
  "title": "Evolution trust registry",
  "type": "object",
  "additionalProperties": false,
  "required": ["schema_version", "registry_id", "control_sources", "components"],
  "properties": {
    "schema_version": {"type": "string", "const": "1.0"},
    "registry_id": {"type": "string", "pattern": "^registry-[a-z0-9]+(?:-[a-z0-9]+)*$"},
    "control_sources": {
      "type": "array",
      "minItems": 1,
      "items": {
        "type": "object",
        "additionalProperties": false,
        "required": [
          "source_id",
          "source_type",
          "allowed_use",
          "human_acceptance_status",
          "scientific_conclusion_allowed",
          "candidate_path",
          "candidate_file_sha256",
          "candidate_object_sha256",
          "candidate_id",
          "decision_packet_path",
          "decision_packet_sha256",
          "packet_id",
          "verification_receipt_path",
          "verification_receipt_sha256",
          "receipt_id",
          "manifest_path",
          "manifest_sha256"
        ],
        "properties": {
          "source_id": {"type": "string", "pattern": "^source-[a-z0-9]+(?:-[a-z0-9]+)*$"},
          "source_type": {"type": "string", "const": "bound_executable_verification_control"},
          "allowed_use": {"type": "string", "const": "process_only_unapplied_policy_proposal"},
          "human_acceptance_status": {"type": "string", "const": "pending"},
          "scientific_conclusion_allowed": {"type": "boolean", "const": false},
          "candidate_path": {"type": "string", "minLength": 3},
          "candidate_file_sha256": {"type": "string", "pattern": "^[a-f0-9]{64}$"},
          "candidate_object_sha256": {"type": "string", "pattern": "^[a-f0-9]{64}$"},
          "candidate_id": {"type": "string", "pattern": "^[a-z0-9]+(?:-[a-z0-9]+)*$"},
          "decision_packet_path": {"type": "string", "minLength": 3},
          "decision_packet_sha256": {"type": "string", "pattern": "^[a-f0-9]{64}$"},
          "packet_id": {"type": "string", "pattern": "^packet-[a-f0-9]{12}$"},
          "verification_receipt_path": {"type": "string", "minLength": 3},
          "verification_receipt_sha256": {"type": "string", "pattern": "^[a-f0-9]{64}$"},
          "receipt_id": {"type": "string", "pattern": "^receipt-[a-z0-9]+(?:-[a-z0-9]+)*$"},
          "manifest_path": {"type": "string", "minLength": 3},
          "manifest_sha256": {"type": "string", "pattern": "^[a-f0-9]{64}$"}
        }
      }
    },
    "components": {
      "type": "array",
      "minItems": 1,
      "items": {
        "type": "object",
        "additionalProperties": false,
        "required": [
          "component_id",
          "component_type",
          "path",
          "current_version",
          "current_sha256"
        ],
        "properties": {
          "component_id": {"type": "string", "pattern": "^component-[a-z0-9]+(?:-[a-z0-9]+)*$"},
          "component_type": {"type": "string", "enum": ["prompt", "skill", "schema", "verifier"]},
          "path": {"type": "string", "minLength": 3},
          "current_version": {"type": "string", "pattern": "^[0-9]+\\.[0-9]+\\.[0-9]+$"},
          "current_sha256": {"type": "string", "pattern": "^[a-f0-9]{64}$"}
        }
      }
    }
  }
}
