{
  "components": [
    {
      "component_id": "component-research-loop-policy",
      "component_type": "prompt",
      "current_sha256": "9098771e0ecf8f95d324989666220eb22da416017931ebdfc1c981991f92c151",
      "current_version": "1.0.0",
      "path": "examples/evolution/components/research-loop-policy.md"
    }
  ],
  "registry_id": "registry-public-evolution-v1",
  "schema_version": "1.0",
  "control_sources": [
    {
      "allowed_use": "process_only_unapplied_policy_proposal",
      "candidate_file_sha256": "d3a6e7cf296b490261a2e4362ee0e915f1fa7c95595d89aa6c37c8259e44334a",
      "candidate_id": "evidence-gated-skill-induction",
      "candidate_object_sha256": "9814e75db275d4dc75122783d6c4958c0b0e0b2c6c40985bf27fcca9242f5966",
      "candidate_path": "examples/candidate.json",
      "decision_packet_path": "examples/expected/decision_packet.json",
      "decision_packet_sha256": "f6edf0904ae84c60b4be5bf12ae7d578b5cfa63d5470a7ac7c2a23852840ab80",
      "human_acceptance_status": "pending",
      "manifest_path": "examples/expected/manifest.json",
      "manifest_sha256": "e869859b631cab622d27f5fc1d02de9713a71f0e99aa19b4db7aa07426aff79c",
      "packet_id": "packet-9814e75db275",
      "receipt_id": "receipt-pipeline-contract-v1",
      "scientific_conclusion_allowed": false,
      "source_id": "source-public-control-receipt",
      "source_type": "bound_executable_verification_control",
      "verification_receipt_path": "examples/verification/pipeline_contract_receipt.json",
      "verification_receipt_sha256": "e80a0143da4aaa8911799b9ca160ccdc8aaa911165b8da922dad6db04c3680aa"
    }
  ]
}
